{
  "$schema": "./pack-manifest.schema.json",
  "schemaVersion": 1,
  "pack": {
    "id": "noah",
    "name": "Noah Official Standards",
    "version": "1.0.0",
    "description": "Architectures, patterns, skills and AI adapters maintained alongside the Noah engine.",
    "license": "MIT"
  },
  "requires": {
    "cli": "1.0.0",
    "features": [
      "arch-extends",
      "skill-capture",
      "adapter-limits",
      "pattern-rules",
      "template-blocks",
      "import-region"
    ]
  },
  "ignore": [
    "**/*.min.js",
    "**/*.generated.*",
    "**/migrations/**"
  ],
  "reporting": {
    "violationTemplate": "❌ ARCHITECTURE VIOLATION DETECTED\nFile: {{file}}\nIssue: {{message}}\nRule Reference: {{ruleDoc}} (Section {{section}})",
    "separator": "\n",
    "exitCode": 1
  },
  "inspect": {
    "ignore": [
      "**/*.snap",
      "**/__snapshots__/**"
    ],
    "maxDepth": 4,
    "maxEntries": 400
  },
  "variables": [
    {
      "id": "projectName",
      "displayName": "Project name",
      "description": "human-readable project name",
      "sources": [
        {
          "from": "flag",
          "name": "project"
        },
        {
          "from": "config",
          "key": "projectName"
        },
        {
          "from": "detect",
          "file": "package.json",
          "regex": "\"name\"\\s*:\\s*\"([^\"]+)\"",
          "group": 1
        },
        {
          "from": "detect",
          "file": "go.mod",
          "regex": "^module\\s+\\S*/([^/\\s]+)\\s*$",
          "group": 1
        },
        {
          "from": "literal",
          "value": "app"
        }
      ]
    }
  ],
  "languages": [
    {
      "id": "typescript",
      "displayName": "TypeScript",
      "extensions": [
        ".ts",
        ".tsx",
        ".mts",
        ".cts"
      ],
      "manifestFiles": [
        "package.json",
        "tsconfig.json"
      ],
      "ignore": [
        "**/*.d.ts",
        "**/*.spec.ts",
        "**/*.test.ts"
      ],
      "comment": {
        "line": "//",
        "blockStart": "/*",
        "blockEnd": "*/",
        "strings": [
          "\"",
          "'",
          "`"
        ]
      },
      "install": "npm install {{dep}}",
      "imports": [
        {
          "id": "esm",
          "regex": "^[ \\t]*import\\s+(?:[^;'\"]*?from\\s+)?['\"]([^'\"]+)['\"]"
        },
        {
          "id": "reexport",
          "regex": "^[ \\t]*export\\s+[^;'\"]*?from\\s+['\"]([^'\"]+)['\"]"
        },
        {
          "id": "require",
          "regex": "\\brequire\\(\\s*['\"]([^'\"]+)['\"]\\s*\\)"
        },
        {
          "id": "dynamic",
          "regex": "\\bimport\\(\\s*['\"]([^'\"]+)['\"]\\s*\\)"
        }
      ]
    },
    {
      "id": "java",
      "displayName": "Java",
      "extensions": [
        ".java"
      ],
      "manifestFiles": [
        "pom.xml",
        "build.gradle",
        "build.gradle.kts"
      ],
      "ignore": [
        "**/generated/**"
      ],
      "comment": {
        "line": "//",
        "blockStart": "/*",
        "blockEnd": "*/",
        "strings": [
          "\"\"\"",
          "\"",
          "'"
        ]
      },
      "install": "add {{dep}} to pom.xml",
      "imports": [
        {
          "id": "import",
          "regex": "^[ \\t]*import\\s+(?:static\\s+)?([A-Za-z_$][\\w.$]*(?:\\.\\*)?)\\s*;"
        }
      ]
    },
    {
      "id": "go",
      "displayName": "Go",
      "extensions": [
        ".go"
      ],
      "manifestFiles": [
        "go.mod"
      ],
      "comment": {
        "line": "//",
        "blockStart": "/*",
        "blockEnd": "*/",
        "strings": [
          "`",
          "\"",
          "'"
        ]
      },
      "install": "go get {{dep}}",
      "imports": [
        {
          "id": "single",
          "regex": "^[ \\t]*import\\s+(?:[\\w.]+\\s+)?\"([^\"]+)\""
        },
        {
          "id": "block",
          "regex": "^[ \\t]+(?:[\\w.]+[ \\t]+)?\"([^\"]+)\"",
          "within": {
            "open": "^import[ \\t]*\\($",
            "close": "^\\)$"
          }
        }
      ]
    },
    {
      "id": "yaml",
      "displayName": "YAML",
      "extensions": [
        ".yml",
        ".yaml"
      ],
      "comment": {
        "line": "#",
        "strings": [
          "\"",
          "'"
        ]
      }
    },
    {
      "id": "dockerfile",
      "displayName": "Dockerfile",
      "extensions": [
        "Dockerfile",
        ".dockerfile"
      ],
      "comment": {
        "line": "#",
        "strings": [
          "\"",
          "'"
        ]
      }
    },
    {
      "id": "shell",
      "displayName": "Shell",
      "extensions": [
        ".sh",
        ".bash"
      ],
      "comment": {
        "line": "#",
        "strings": [
          "\"",
          "'"
        ]
      }
    }
  ],
  "architectures": [
    {
      "id": "nest-clean",
      "language": "typescript",
      "framework": "nestjs",
      "displayName": "NestJS Clean Architecture",
      "description": "Controllers, use cases, a framework-free domain and infrastructure adapters.",
      "tags": [
        "backend",
        "clean",
        "ddd"
      ],
      "path": "architectures/typescript/nest-clean",
      "variables": [
        {
          "id": "srcRoot",
          "displayName": "Source root",
          "sources": [
            {
              "from": "flag",
              "name": "src-root"
            },
            {
              "from": "config",
              "key": "srcRoot"
            },
            {
              "from": "literal",
              "value": "src"
            }
          ]
        },
        {
          "id": "moduleName",
          "displayName": "Module",
          "description": "module directory this belongs to",
          "sources": [
            {
              "from": "flag",
              "name": "module"
            },
            {
              "from": "config",
              "key": "moduleName"
            },
            {
              "from": "derive",
              "template": "{{name}}"
            }
          ],
          "transform": [
            [
              "kebab"
            ],
            [
              "stripSuffix",
              "-service"
            ],
            [
              "stripSuffix",
              "-controller"
            ]
          ]
        },
        {
          "id": "serviceName",
          "displayName": "Service name",
          "sources": [
            {
              "from": "derive",
              "template": "{{name}}"
            }
          ],
          "validate": {
            "regex": "^[A-Za-z][A-Za-z0-9 _-]*$",
            "message": "a name may contain letters, digits, spaces, '-' and '_'"
          }
        },
        {
          "id": "serviceClass",
          "sources": [
            {
              "from": "derive",
              "template": "{{serviceName}}"
            }
          ],
          "transform": [
            [
              "pascal"
            ],
            [
              "ensureSuffix",
              "Service"
            ]
          ]
        },
        {
          "id": "serviceFile",
          "sources": [
            {
              "from": "derive",
              "template": "{{serviceName}}"
            }
          ],
          "transform": [
            [
              "kebab"
            ],
            [
              "stripSuffix",
              "-service"
            ]
          ]
        },
        {
          "id": "domainClass",
          "description": "domain class name, derived from the service name",
          "sources": [
            {
              "from": "derive",
              "template": "{{serviceName}}"
            }
          ],
          "transform": [
            [
              "pascal"
            ],
            [
              "stripSuffix",
              "Service"
            ]
          ]
        }
      ],
      "layers": [
        {
          "id": "controller",
          "displayName": "Controller",
          "section": "2.1",
          "include": [
            "{{srcRoot}}/**/*.controller.ts",
            "{{srcRoot}}/**/presentation/**"
          ]
        },
        {
          "id": "application",
          "displayName": "Application",
          "section": "3.1",
          "include": [
            "{{srcRoot}}/**/application/**",
            "{{srcRoot}}/**/*.use-case.ts",
            "{{srcRoot}}/**/*.service.ts"
          ],
          "exclude": [
            "{{srcRoot}}/**/infrastructure/**"
          ]
        },
        {
          "id": "domain",
          "displayName": "Domain",
          "section": "4.1",
          "include": [
            "{{srcRoot}}/**/domain/**",
            "{{srcRoot}}/**/*.entity.ts"
          ]
        },
        {
          "id": "infrastructure",
          "displayName": "Infrastructure",
          "section": "5.0",
          "include": [
            "{{srcRoot}}/**/infrastructure/**",
            "{{srcRoot}}/**/*.repository.ts"
          ]
        }
      ],
      "rules": [
        {
          "id": "controller-no-persistence",
          "layer": "controller",
          "section": "2.1",
          "forbid": [
            "^typeorm$",
            "^@prisma/client$",
            "^mongoose$",
            "^pg$",
            "^mysql2?$",
            "^knex$"
          ],
          "message": "Direct import of '{{import}}' in Controller level."
        },
        {
          "id": "domain-no-framework",
          "layer": "domain",
          "section": "4.1",
          "forbid": [
            "^@nestjs/",
            "^typeorm$",
            "^@prisma/client$",
            "^axios$",
            "^express$",
            "^ioredis$"
          ],
          "message": "Domain imports '{{import}}'. The domain layer must stay free of framework and infrastructure dependencies."
        },
        {
          "id": "application-no-http",
          "layer": "application",